{"$id":"https://shieldkit-labs.local/p2/gate-b/gate-b0-evidence-plan/v1/root.v1.schema.json","$schema":"https://json-schema.org/draft/2020-12/schema","additionalProperties":false,"properties":{"apiVersion":{"const":"shieldkit-labs/p2/gate-b/gate-b0-evidence-plan/v1"},"authorityProjection":{"additionalProperties":false,"properties":{"authorities":{"items":{"oneOf":[{"additionalProperties":false,"properties":{"authorityId":{"const":"B0R_LANE_AUTHORITY_PROJECTION"},"kind":{"const":"EMBEDDED_CLOSED_SNAPSHOT"},"projection":{"additionalProperties":false,"properties":{"contentDigest":{"$ref":"digest.v1.schema.json"},"schema":{"const":"shieldkit-labs/p2/gate-b/gate-b0-evidence-plan/v1/lane-authority-projection/v1"},"snapshot":{"const":{"apiVersion":"shieldkit-labs.research-lane/v1alpha1","boundaries":["The raw Telegram export is local-only and is not a canonical Atlas artifact.","The diagram is an observed artifact, not a universal protocol schema.","Sourced means faithfully attributed; it does not mean independently true.","The Chipnet transaction proves transaction shape and committed bytes, not their private semantics.","PoolActionFv1 backend-neutral semantics are frozen, but deployment configuration and every cryptographic instantiation remain unselected.","Planned vectors, schemas, controls, and projections are not measurements or complete-transaction evidence.","No Atlas Architecture, Module, Claim, Hypothesis, Evidence, or Decision is created by this lane.","No represented option is qualified, product-ready, audited, or recommended for mainnet."],"id":"research-lane:bch-shielded-pool-design","kind":"ResearchLane","objective":"Design and qualify a Circle-FRI-based fixed-ticket Bitcoin Cash deposit/withdrawal pool with unilateral spends, one user action per transaction, and no user batching.","productDecisions":{"client":{"interface":"local desktop CLI","outOfScope":["mobile client","graphical desktop client","browser client","required remote prover"],"proving":"local and unilateral","withdrawalTargetComparison":"less-than","withdrawalTargetSeconds":60},"postQuantum":{"claimPolicy":"Do not claim the complete system is post-quantum while current BCH or any transaction component retains an unqualified classical dependency.","goal":"PQ-oriented proof and private spend path","guardrail":"Prefer mature hash-based or otherwise defensible PQ-oriented components, but do not weaken classical security, transaction binding, privacy, availability, standardness, or implementation assurance merely to remove an assumption.","requiredReview":"component-by-component assumption inventory covering proof soundness and zero knowledge, hashes, commitments, nullifiers, note authorization, wallet storage and recovery, transaction authorization, and the BCH settlement boundary"},"selectedAt":"2026-08-08T00:00:00Z","soundness":{"fallbackRule":"Select the strongest concretely derived parameter set at or above 100 bits that fits; never lower security silently or optimize an isolated proof component instead of the complete transaction.","fallbackTrigger":"A concretely derived 128-bit configuration cannot fit in one complete 100,000-byte standard BCH transaction after measured protocol, verifier, and encoding optimization.","minimumBits":100,"standardTransactionLimitBytes":100000,"targetBits":128},"status":"frozen","ticket":{"denomination":"0.1 BCH","denominationSatoshis":10000000,"feeFunding":"separate transparent non-pool input","feePrivacy":"out of scope","poolReserveDeltaSatoshis":10000000,"withdrawalPayoutSatoshis":10000000}},"promotionGate":{"requires":["responsibility-complete architecture decompositions","explicit fixed-denomination, ticket-count, conservation, uniqueness, membership, and transaction-binding relations","strict schema and cross-artifact validation with no fabricated evidence","current-BCH embodiment and standard-transaction reality gates","Circle FRI artifacts with measured soundness, zero knowledge, bytes, VM cost, and adversarial evidence","complete optimized 128-bit deposit and withdrawal transactions before any fallback authorization","trust, liveness, availability, privacy-leakage, and reconstructability review"],"status":"closed"},"proofBackendDecision":{"family":"Circle-domain FRI","id":"proof-backend:circle-fri","implementationScope":"A direct custom PoolActionFv1 AIR, proof protocol, prover, encoding, and BCH verifier; no generic VM or external prover stack is selected as a dependency.","inactiveComparators":["Groth16","conventional Goldilocks FRI","WHIR"],"priorArtPolicy":"Stwo and other implementations are evidence and comparison sources only, not protocol authorities or implementation bases.","required":["field, extension tower, and circle-domain selection derived from BCH verifier cost","concrete witness masking and zero-knowledge leakage analysis designed with the protocol","explicit Circle-FRI soundness parameters and derivation","BCH-oriented transcript and Merkle hash selection","canonical field encoding, extension arithmetic, and proof parsing","one complete standard BCH transaction per action","under-60-second withdrawal proving on the pinned desktop"],"researchMethod":"first-principles BCH co-design","selectedAt":"2026-08-08T00:00:00Z","status":"frozen"},"scopeDecision":{"outOfScope":["private transfers","multi-user batching","change notes","variable amounts"],"profileRef":"profile:fixed-ticket-serial-pool","relation":"Transparent fixed-ticket deposit followed by one unilateral withdrawal to ordinary BCH.","required":["one deposit transaction per ticket","one withdrawal transaction per ticket","one user action and one action proof per transaction","full on-chain proof and conservation enforcement","public reconstructability","no required coordinator or private service"],"selectedAt":"2026-08-08T00:00:00Z","status":"frozen"}}}},"required":["contentDigest","schema","snapshot"],"type":"object"}},"required":["authorityId","kind","projection"],"type":"object"},{"additionalProperties":false,"properties":{"authorityId":{"const":"B0R_ATLAS_PRODUCT_PROFILE"},"bytes":{"const":2402},"rawSha256":{"const":"53aa66359f34677a051d86d8f9cd05d973a2ef4da30d30af7c297bcaa812f7bc"},"sourceCatalogEntryId":{"const":"source:atlas-product-profile"}},"required":["authorityId","bytes","rawSha256","sourceCatalogEntryId"],"type":"object"},{"additionalProperties":false,"properties":{"aggregateSha256":{"const":"db057332197d7a48a90eb65e55884455ab1388e8a0a970f1cb9a9d3b3f17dc52"},"authorityId":{"const":"B0R_P0_FREEZE_MANIFEST"},"bytes":{"const":2587},"expectedLeafCount":{"const":11},"rawSha256":{"const":"a55ebd49f117956dc3b0c8a94cf3a3e7b40c5d7477de2a99c53d58bef00012c2"},"sourceCatalogEntryId":{"const":"source:p0-freeze-manifest"}},"required":["aggregateSha256","authorityId","bytes","expectedLeafCount","rawSha256","sourceCatalogEntryId"],"type":"object"},{"additionalProperties":false,"properties":{"authorityId":{"const":"B0R_BCH_ENVIRONMENT_PROFILE"},"bytes":{"const":3214},"expected":{"additionalProperties":false,"properties":{"id":{"const":"profile:bch-current-2026-08-08"},"ruleset":{"const":"May 2026 Upgrade 12 plus May 2025 VM limits"},"status":{"const":"source-pinned-current-research-profile"}},"required":["id","ruleset","status"],"type":"object"},"rawSha256":{"const":"d1ec071c1630d38dc719d5a040f36cc94fa02ac7d7f832769d09788595c80e3f"},"sourceCatalogEntryId":{"const":"source:bch-environment-profile"}},"required":["authorityId","bytes","expected","rawSha256","sourceCatalogEntryId"],"type":"object"},{"additionalProperties":false,"properties":{"authorityId":{"const":"B0R_DESKTOP_PROVER_PROFILE"},"bytes":{"const":2261},"expected":{"additionalProperties":false,"properties":{"id":{"const":"profile:desktop-prover-i9-13900h-2026-08-08"},"status":{"const":"pinned-research-host-unbenchmarked"},"targetState":{"const":"NOT_DECLARED"},"threadWorkers":{"const":20}},"required":["id","status","targetState","threadWorkers"],"type":"object"},"rawSha256":{"const":"924df812661afba9135af3efbb4c338199f11d47b20e6cef77bd1708cf8a6065"},"sourceCatalogEntryId":{"const":"source:desktop-prover-profile"}},"required":["authorityId","bytes","expected","rawSha256","sourceCatalogEntryId"],"type":"object"}]},"maxItems":5,"minItems":5,"type":"array"}},"required":["authorities"],"type":"object"},"campaignTruth":{"additionalProperties":false,"properties":{"counts":{"additionalProperties":false,"properties":{"arms":{"const":14},"constructions":{"const":4},"corpusCases":{"const":1288},"engines":{"const":4},"fixtures":{"const":4732},"preflightViolations":{"const":124},"relationTargetsOrPlans":{"const":42},"workItems":{"const":18928}},"required":["arms","constructions","corpusCases","engines","fixtures","preflightViolations","relationTargetsOrPlans","workItems"],"type":"object"},"executionAvailable":{"const":false},"metricsAvailable":{"const":false},"rankingAvailable":{"const":false},"selectionAvailable":{"const":false},"sourceCatalogEntryIds":{"items":{"pattern":"^source:","type":"string"},"maxItems":13,"minItems":13,"type":"array"}},"required":["counts","executionAvailable","metricsAvailable","rankingAvailable","selectionAvailable","sourceCatalogEntryIds"],"type":"object"},"componentDigests":{"items":{"additionalProperties":false,"properties":{"component":{"enum":["authorityProjection","sourceCatalog","protocolAxisContract","legacyReconciliation","primitiveBenchmarkTemplate","measurementAdmissionContract","campaignTruth","phaseDag","nonAuthorityBoundary"],"type":"string"},"digest":{"$ref":"digest.v1.schema.json"}},"required":["component","digest"],"type":"object"},"maxItems":9,"minItems":9,"type":"array"},"contentDigest":{"$ref":"digest.v1.schema.json"},"kind":{"const":"GateB0EvidencePlan"},"legacyReconciliation":{"additionalProperties":false,"properties":{"legacyMethodsAndPassCriteria":{"const":"NONAUTHORITATIVE_LEGACY_PROSE_CANNOT_SATISFY_TYPED_GATE"},"rowBindings":{"items":{"additionalProperties":false,"properties":{"axis":{"enum":["field-extension","circle-domain","hash-transcript","zk-masking","air","fri","nullifier-set","authorization","verifier-topology"],"type":"string"},"currentStatus":{"enum":["measured-nonselected","control-only","unmeasured","killed","blocked-source-pin"],"type":"string"},"legacyGateId":{"additionalProperties":false,"properties":{"kind":{"const":"UNAVAILABLE_LEGACY_PROSE_GATE_ID"}},"required":["kind"],"type":"object"},"rowId":{"pattern":"^[a-z-]+:","type":"string"},"typedKillGateId":{"pattern":"^kill-gate:b0r:","type":"string"}},"required":["axis","currentStatus","legacyGateId","rowId","typedKillGateId"],"type":"object"},"maxItems":33,"minItems":33,"type":"array"},"typedKillGates":{"items":{"$ref":"kill-gate.v1.schema.json"},"maxItems":33,"minItems":33,"type":"array"}},"required":["legacyMethodsAndPassCriteria","rowBindings","typedKillGates"],"type":"object"},"measurementAdmissionContract":{"additionalProperties":false,"properties":{"adversarialCaseSchema":{"const":"schemas/adversarial-case.v2.schema.json"},"categoryPresenceIsCompleteCorpusEvidence":{"const":false},"measurementAdmissionAllowed":{"const":false},"measurementResultSchema":{"const":"schemas/measurement-result.v2.schema.json"},"missingAdditiveClasses":{"items":{"enum":["CIRCLE_DOMAIN","MERKLE_PATH_MULTIPROOF","TRANSCRIPT_ORDERING_DOMAIN_REJECTION","DEEP_OOD","FRI_SCHEDULE_INDEX","MASKING_EXPOSURE_REUSE"],"type":"string"},"maxItems":6,"minItems":6,"type":"array","uniqueItems":true},"plannedVectorObligations":{"items":{"additionalProperties":false,"properties":{"caseId":{"pattern":"^vector:","type":"string"},"currentObligation":{"pattern":"^P0_","type":"string"},"state":{"const":"PLANNED_VECTOR_NOT_CORPUS_EVIDENCE"}},"required":["caseId","currentObligation","state"],"type":"object"},"maxItems":79,"minItems":79,"type":"array"},"requiredVectorCount":{"const":79}},"required":["adversarialCaseSchema","categoryPresenceIsCompleteCorpusEvidence","measurementAdmissionAllowed","measurementResultSchema","missingAdditiveClasses","plannedVectorObligations","requiredVectorCount"],"type":"object"},"nonAuthorityBoundary":{"additionalProperties":false,"properties":{"candidateCount":{"const":0},"candidateTupleCount":{"const":0},"executionAllowed":{"const":false},"fallbackAuthorizationAllowed":{"const":false},"measurementAdmissionAllowed":{"const":false},"parameterAssignmentCount":{"const":0},"providerInstanceCount":{"const":0},"qualificationAllowed":{"const":false},"rankingAllowed":{"const":false},"roleAssignmentCount":{"const":0},"selectionAllowed":{"const":false},"status":{"const":"static-nonauthorizing-unqualified-plan-only-no-candidates-no-execution-no-selection"},"unavailableStatePolicy":{"const":"TAGGED_STATE_NEVER_NULL"}},"required":["candidateCount","candidateTupleCount","executionAllowed","fallbackAuthorizationAllowed","measurementAdmissionAllowed","parameterAssignmentCount","providerInstanceCount","qualificationAllowed","rankingAllowed","roleAssignmentCount","selectionAllowed","status","unavailableStatePolicy"],"type":"object"},"phaseDag":{"additionalProperties":false,"properties":{"edges":{"items":{"items":false,"maxItems":2,"minItems":2,"prefixItems":[{"type":"string"},{"type":"string"}],"type":"array"},"maxItems":7,"minItems":7,"type":"array"},"nodes":{"items":{"additionalProperties":false,"properties":{"nodeId":{"enum":["AUTHORITY_FREEZE","SCHEMA_TEMPLATE_WORK","B0_EXECUTION_AUTHORIZATION","COMPLETE_B0_EPOCH","B0_ROOT_SOL_REVIEW","B1_V2_DESCRIPTOR_LANGUAGE_AND_INSTANCES","GATE_C","P3_SELECTION"],"type":"string"},"plannedOutputScope":{"pattern":"^future/","type":"string"},"writeAuthority":{"const":"NONE"}},"required":["nodeId","plannedOutputScope","writeAuthority"],"type":"object"},"maxItems":8,"minItems":8,"type":"array"}},"required":["edges","nodes"],"type":"object"},"primitiveBenchmarkTemplate":{"additionalProperties":false,"properties":{"canonicalCodecContractState":{"const":"PENDING_ADDITIVE_SCHEMA"},"engineApplicability":{"items":{"additionalProperties":false,"properties":{"engineId":{"enum":["engine:native","engine:libauth","engine:bchn","engine:leanbch"],"type":"string"},"state":{"const":"PENDING_ADDITIVE_SCHEMA"}},"required":["engineId","state"],"type":"object"},"maxItems":4,"minItems":4,"type":"array"},"inputOutputRoleContractState":{"const":"PENDING_ADDITIVE_SCHEMA"},"metricDerivationContractState":{"const":"PENDING_ADDITIVE_SCHEMA"},"rawByteFullConsumptionContractState":{"const":"PENDING_ADDITIVE_SCHEMA"},"responsibilityThreatContractState":{"const":"PENDING_ADDITIVE_SCHEMA"},"semanticOperation":{"const":"PRIMITIVE_OPERATION_PENDING_ADDITIVE_BINDING"},"templateId":{"const":"primitive-benchmark-template:v2"},"typedKillGateRef":{"const":"kill-gate:b0r:primitive-template"}},"required":["canonicalCodecContractState","engineApplicability","inputOutputRoleContractState","metricDerivationContractState","rawByteFullConsumptionContractState","responsibilityThreatContractState","semanticOperation","templateId","typedKillGateRef"],"type":"object"},"protocolAxisContract":{"additionalProperties":false,"properties":{"axes":{"items":{"additionalProperties":false,"properties":{"axis":{"enum":["field-extension","circle-domain","hash-transcript","zk-masking","air","fri","nullifier-set","authorization","verifier-topology"],"type":"string"},"languageState":{"const":"PENDING_ADDITIVE_SCHEMA"},"planningOnly":{"const":true}},"required":["axis","languageState","planningOnly"],"type":"object"},"maxItems":9,"minItems":9,"type":"array"},"componentFields":{"items":{"additionalProperties":false,"properties":{"assignmentStates":{"additionalProperties":false,"properties":{"air":{"enum":["UNAVAILABLE","PENDING_ADDITIVE_SCHEMA"],"type":"string"},"circle":{"enum":["UNAVAILABLE","PENDING_ADDITIVE_SCHEMA"],"type":"string"},"deep":{"enum":["UNAVAILABLE","PENDING_ADDITIVE_SCHEMA"],"type":"string"},"embedding":{"enum":["UNAVAILABLE","PENDING_ADDITIVE_SCHEMA"],"type":"string"},"fri":{"enum":["UNAVAILABLE","PENDING_ADDITIVE_SCHEMA"],"type":"string"},"hash":{"enum":["UNAVAILABLE","PENDING_ADDITIVE_SCHEMA"],"type":"string"},"masking":{"enum":["UNAVAILABLE","PENDING_ADDITIVE_SCHEMA"],"type":"string"},"query":{"enum":["UNAVAILABLE","PENDING_ADDITIVE_SCHEMA"],"type":"string"},"role":{"enum":["UNAVAILABLE","PENDING_ADDITIVE_SCHEMA"],"type":"string"},"topology":{"enum":["UNAVAILABLE","PENDING_ADDITIVE_SCHEMA"],"type":"string"},"transcript":{"enum":["UNAVAILABLE","PENDING_ADDITIVE_SCHEMA"],"type":"string"}},"required":["air","circle","deep","embedding","fri","hash","masking","query","role","topology","transcript"],"type":"object"},"componentStatus":{"const":"COMPONENT_ONLY"},"fieldSpecId":{"pattern":"^field-spec:","type":"string"}},"required":["assignmentStates","componentStatus","fieldSpecId"],"type":"object"},"maxItems":14,"minItems":14,"type":"array"},"expectedFieldRecordCount":{"const":14}},"required":["axes","componentFields","expectedFieldRecordCount"],"type":"object"},"schema":{"const":"https://shieldkit-labs.local/p2/gate-b/gate-b0-evidence-plan/v1/root.v1.schema.json"},"sourceCatalog":{"additionalProperties":false,"properties":{"entries":{"items":{"additionalProperties":false,"properties":{"authorityClass":{"enum":["PROFILE_OBSERVATION","LEGACY_SHAPE_OR_OBLIGATION_AUTHORITY","COMPONENT_ONLY_REGISTRY","OBLIGATION_AUTHORITY_NOT_CORPUS_EVIDENCE","P0_INPUT_AUTHORITY","P0_FREEZE_AUTHORITY","FROZEN_PREMEASUREMENT_INPUT","FROZEN_CAMPAIGN_INPUT"],"type":"string"},"bytes":{"minimum":0,"type":"integer"},"entryId":{"pattern":"^source:","type":"string"},"locator":{"minLength":1,"type":"string"},"rawSha256":{"pattern":"^[0-9a-f]{64}$","type":"string"},"semanticDigest":{"oneOf":[{"additionalProperties":false,"properties":{"extractionKind":{"const":"NONE"},"kind":{"const":"NOT_DECLARED"}},"required":["extractionKind","kind"],"type":"object"},{"additionalProperties":false,"properties":{"extractionKind":{"enum":["CONTENT_DIGEST_STRING","CONTENT_DIGEST_RECORD_VALUE","AGGREGATE_SHA256"],"type":"string"},"kind":{"const":"DECLARED_SEMANTIC_DIGEST"},"value":{"pattern":"^[0-9a-f]{64}$","type":"string"}},"required":["extractionKind","kind","value"],"type":"object"}]}},"required":["authorityClass","bytes","entryId","locator","rawSha256","semanticDigest"],"type":"object"},"maxItems":35,"minItems":35,"type":"array"}},"required":["entries"],"type":"object"},"status":{"const":"static-nonauthorizing-unqualified-plan-only-no-candidates-no-execution-no-selection"}},"required":["apiVersion","authorityProjection","campaignTruth","componentDigests","contentDigest","kind","legacyReconciliation","measurementAdmissionContract","nonAuthorityBoundary","phaseDag","primitiveBenchmarkTemplate","protocolAxisContract","schema","sourceCatalog","status"],"type":"object"}
