{"apiVersion":"shieldkit-labs/p2/gate-b/gate-b0-evidence-plan/v1","authorityProjection":{"authorities":[{"authorityId":"B0R_LANE_AUTHORITY_PROJECTION","kind":"EMBEDDED_CLOSED_SNAPSHOT","projection":{"contentDigest":{"algorithm":"sha256","canonicalization":"recursive-lexicographic-object-key-sort-arrays-preserve-order-json-utf8-lf-v1","domain":"shieldkit-labs/p2/gate-b/gate-b0-evidence-plan/v1/lane-authority-projection","frame":"utf8(domain)||0x00||canonical-json-utf8||0x0a","value":"7ab73381ae474648873d94f99d7227b9558f5fbb49eff8066132f0b2520ba138"},"schema":"shieldkit-labs/p2/gate-b/gate-b0-evidence-plan/v1/lane-authority-projection/v1","snapshot":{"apiVersion":"shieldkit-labs.research-lane/v1alpha1","boundaries":["The raw Telegram export is local-only and is not a canonical Atlas artifact.","The diagram is an observed artifact, not a universal protocol schema.","Sourced means faithfully attributed; it does not mean independently true.","The Chipnet transaction proves transaction shape and committed bytes, not their private semantics.","PoolActionFv1 backend-neutral semantics are frozen, but deployment configuration and every cryptographic instantiation remain unselected.","Planned vectors, schemas, controls, and projections are not measurements or complete-transaction evidence.","No Atlas Architecture, Module, Claim, Hypothesis, Evidence, or Decision is created by this lane.","No represented option is qualified, product-ready, audited, or recommended for mainnet."],"id":"research-lane:bch-shielded-pool-design","kind":"ResearchLane","objective":"Design and qualify a Circle-FRI-based fixed-ticket Bitcoin Cash deposit/withdrawal pool with unilateral spends, one user action per transaction, and no user batching.","productDecisions":{"client":{"interface":"local desktop CLI","outOfScope":["mobile client","graphical desktop client","browser client","required remote prover"],"proving":"local and unilateral","withdrawalTargetComparison":"less-than","withdrawalTargetSeconds":60},"postQuantum":{"claimPolicy":"Do not claim the complete system is post-quantum while current BCH or any transaction component retains an unqualified classical dependency.","goal":"PQ-oriented proof and private spend path","guardrail":"Prefer mature hash-based or otherwise defensible PQ-oriented components, but do not weaken classical security, transaction binding, privacy, availability, standardness, or implementation assurance merely to remove an assumption.","requiredReview":"component-by-component assumption inventory covering proof soundness and zero knowledge, hashes, commitments, nullifiers, note authorization, wallet storage and recovery, transaction authorization, and the BCH settlement boundary"},"selectedAt":"2026-08-08T00:00:00Z","soundness":{"fallbackRule":"Select the strongest concretely derived parameter set at or above 100 bits that fits; never lower security silently or optimize an isolated proof component instead of the complete transaction.","fallbackTrigger":"A concretely derived 128-bit configuration cannot fit in one complete 100,000-byte standard BCH transaction after measured protocol, verifier, and encoding optimization.","minimumBits":100,"standardTransactionLimitBytes":100000,"targetBits":128},"status":"frozen","ticket":{"denomination":"0.1 BCH","denominationSatoshis":10000000,"feeFunding":"separate transparent non-pool input","feePrivacy":"out of scope","poolReserveDeltaSatoshis":10000000,"withdrawalPayoutSatoshis":10000000}},"promotionGate":{"requires":["responsibility-complete architecture decompositions","explicit fixed-denomination, ticket-count, conservation, uniqueness, membership, and transaction-binding relations","strict schema and cross-artifact validation with no fabricated evidence","current-BCH embodiment and standard-transaction reality gates","Circle FRI artifacts with measured soundness, zero knowledge, bytes, VM cost, and adversarial evidence","complete optimized 128-bit deposit and withdrawal transactions before any fallback authorization","trust, liveness, availability, privacy-leakage, and reconstructability review"],"status":"closed"},"proofBackendDecision":{"family":"Circle-domain FRI","id":"proof-backend:circle-fri","implementationScope":"A direct custom PoolActionFv1 AIR, proof protocol, prover, encoding, and BCH verifier; no generic VM or external prover stack is selected as a dependency.","inactiveComparators":["Groth16","conventional Goldilocks FRI","WHIR"],"priorArtPolicy":"Stwo and other implementations are evidence and comparison sources only, not protocol authorities or implementation bases.","required":["field, extension tower, and circle-domain selection derived from BCH verifier cost","concrete witness masking and zero-knowledge leakage analysis designed with the protocol","explicit Circle-FRI soundness parameters and derivation","BCH-oriented transcript and Merkle hash selection","canonical field encoding, extension arithmetic, and proof parsing","one complete standard BCH transaction per action","under-60-second withdrawal proving on the pinned desktop"],"researchMethod":"first-principles BCH co-design","selectedAt":"2026-08-08T00:00:00Z","status":"frozen"},"scopeDecision":{"outOfScope":["private transfers","multi-user batching","change notes","variable amounts"],"profileRef":"profile:fixed-ticket-serial-pool","relation":"Transparent fixed-ticket deposit followed by one unilateral withdrawal to ordinary BCH.","required":["one deposit transaction per ticket","one withdrawal transaction per ticket","one user action and one action proof per transaction","full on-chain proof and conservation enforcement","public reconstructability","no required coordinator or private service"],"selectedAt":"2026-08-08T00:00:00Z","status":"frozen"}}}},{"authorityId":"B0R_ATLAS_PRODUCT_PROFILE","bytes":2402,"rawSha256":"53aa66359f34677a051d86d8f9cd05d973a2ef4da30d30af7c297bcaa812f7bc","sourceCatalogEntryId":"source:atlas-product-profile"},{"aggregateSha256":"db057332197d7a48a90eb65e55884455ab1388e8a0a970f1cb9a9d3b3f17dc52","authorityId":"B0R_P0_FREEZE_MANIFEST","bytes":2587,"expectedLeafCount":11,"rawSha256":"a55ebd49f117956dc3b0c8a94cf3a3e7b40c5d7477de2a99c53d58bef00012c2","sourceCatalogEntryId":"source:p0-freeze-manifest"},{"authorityId":"B0R_BCH_ENVIRONMENT_PROFILE","bytes":3214,"expected":{"id":"profile:bch-current-2026-08-08","ruleset":"May 2026 Upgrade 12 plus May 2025 VM limits","status":"source-pinned-current-research-profile"},"rawSha256":"d1ec071c1630d38dc719d5a040f36cc94fa02ac7d7f832769d09788595c80e3f","sourceCatalogEntryId":"source:bch-environment-profile"},{"authorityId":"B0R_DESKTOP_PROVER_PROFILE","bytes":2261,"expected":{"id":"profile:desktop-prover-i9-13900h-2026-08-08","status":"pinned-research-host-unbenchmarked","targetState":"NOT_DECLARED","threadWorkers":20},"rawSha256":"924df812661afba9135af3efbb4c338199f11d47b20e6cef77bd1708cf8a6065","sourceCatalogEntryId":"source:desktop-prover-profile"}]},"campaignTruth":{"counts":{"arms":14,"constructions":4,"corpusCases":1288,"engines":4,"fixtures":4732,"preflightViolations":124,"relationTargetsOrPlans":42,"workItems":18928},"executionAvailable":false,"metricsAvailable":false,"rankingAvailable":false,"selectionAvailable":false,"sourceCatalogEntryIds":["source:construction-freeze","source:schedule-freeze","source:cohort-v2-manifest","source:cohort-v2-campaign","source:cohort-v2-corpus","source:cohort-v2-fixtures","source:cohort-v2-work-items","source:cohort-v2-epoch","source:cohort-v3-freeze","source:engine-native","source:engine-libauth","source:engine-bchn","source:engine-leanbch"]},"componentDigests":[{"component":"authorityProjection","digest":{"algorithm":"sha256","canonicalization":"recursive-lexicographic-object-key-sort-arrays-preserve-order-json-utf8-lf-v1","domain":"shieldkit-labs/p2/gate-b/gate-b0-evidence-plan/v1/authority-projection","frame":"utf8(domain)||0x00||canonical-json-utf8||0x0a","value":"a75429b4053464b33ba40a67f98bad39e09ef779867c23acfe5fa3623b26e5e6"}},{"component":"sourceCatalog","digest":{"algorithm":"sha256","canonicalization":"recursive-lexicographic-object-key-sort-arrays-preserve-order-json-utf8-lf-v1","domain":"shieldkit-labs/p2/gate-b/gate-b0-evidence-plan/v1/source-catalog","frame":"utf8(domain)||0x00||canonical-json-utf8||0x0a","value":"e22f0e95e15d959fc644ba13e033c938da0b253d467476a26965c452050cfbb1"}},{"component":"protocolAxisContract","digest":{"algorithm":"sha256","canonicalization":"recursive-lexicographic-object-key-sort-arrays-preserve-order-json-utf8-lf-v1","domain":"shieldkit-labs/p2/gate-b/gate-b0-evidence-plan/v1/protocol-axis-contract","frame":"utf8(domain)||0x00||canonical-json-utf8||0x0a","value":"29e34f0eed59e84642f63402420031d3b60741d9467ff96f5368f2e76347be27"}},{"component":"legacyReconciliation","digest":{"algorithm":"sha256","canonicalization":"recursive-lexicographic-object-key-sort-arrays-preserve-order-json-utf8-lf-v1","domain":"shieldkit-labs/p2/gate-b/gate-b0-evidence-plan/v1/legacy-reconciliation","frame":"utf8(domain)||0x00||canonical-json-utf8||0x0a","value":"6621e1e91d579e00834b46f0869108c0015bbc55fe4b031cfdf7dd670d20453b"}},{"component":"primitiveBenchmarkTemplate","digest":{"algorithm":"sha256","canonicalization":"recursive-lexicographic-object-key-sort-arrays-preserve-order-json-utf8-lf-v1","domain":"shieldkit-labs/p2/gate-b/gate-b0-evidence-plan/v1/primitive-benchmark-template","frame":"utf8(domain)||0x00||canonical-json-utf8||0x0a","value":"82dd593d67ae6681b32c8b1c1bbee172c5b68ee8249e16ff4837b4cee38853c2"}},{"component":"measurementAdmissionContract","digest":{"algorithm":"sha256","canonicalization":"recursive-lexicographic-object-key-sort-arrays-preserve-order-json-utf8-lf-v1","domain":"shieldkit-labs/p2/gate-b/gate-b0-evidence-plan/v1/measurement-admission-contract","frame":"utf8(domain)||0x00||canonical-json-utf8||0x0a","value":"1f32c93242301bfef25faad66cf2f9768b16e1859a7c4a94f32fee2cb1a8b290"}},{"component":"campaignTruth","digest":{"algorithm":"sha256","canonicalization"